{
  "schema_version": "1.0.0",
  "session_id": "sess_l1_0001",
  "objective_id": "obj_l1_research",
  "created_at": "2026-02-06T03:58:05Z",
  "case_id": "case_sess_l1_0001",
  "entities": [
    {
      "entity_id": "person_victim",
      "entity_type": "PERSON",
      "role_label": "victim",
      "display_name": "victim",
      "fields": [
        {
          "field": "occupation",
          "value": "taxi driver",
          "source_tag": "REAL",
          "sources": [
            "src_001"
          ]
        },
        {
          "field": "estimated_age",
          "value": null,
          "source_tag": "NO_INFO"
        },
        {
          "field": "gender",
          "value": null,
          "source_tag": "NO_INFO"
        },
        {
          "field": "ethnicity",
          "value": null,
          "source_tag": "NO_INFO"
        },
        {
          "field": "hair_style",
          "value": null,
          "source_tag": "NO_INFO"
        },
        {
          "field": "hair_color",
          "value": null,
          "source_tag": "NO_INFO"
        },
        {
          "field": "body_type",
          "value": null,
          "source_tag": "NO_INFO"
        },
        {
          "field": "outfit_signature",
          "value": null,
          "source_tag": "NO_INFO"
        },
        {
          "field": "face_signature",
          "value": null,
          "source_tag": "NO_INFO"
        }
      ]
    },
    {
      "entity_id": "person_perpetrator",
      "entity_type": "PERSON",
      "role_label": "perpetrator",
      "display_name": "perpetrator",
      "fields": [
        {
          "field": "occupation",
          "value": "taxi driver",
          "source_tag": "REAL",
          "sources": [
            "src_001"
          ]
        },
        {
          "field": "estimated_age",
          "value": null,
          "source_tag": "NO_INFO"
        },
        {
          "field": "gender",
          "value": null,
          "source_tag": "NO_INFO"
        },
        {
          "field": "ethnicity",
          "value": null,
          "source_tag": "NO_INFO"
        },
        {
          "field": "hair_style",
          "value": null,
          "source_tag": "NO_INFO"
        },
        {
          "field": "hair_color",
          "value": null,
          "source_tag": "NO_INFO"
        },
        {
          "field": "body_type",
          "value": null,
          "source_tag": "NO_INFO"
        },
        {
          "field": "outfit_signature",
          "value": null,
          "source_tag": "NO_INFO"
        },
        {
          "field": "face_signature",
          "value": null,
          "source_tag": "NO_INFO"
        }
      ]
    },
    {
      "entity_id": "location_primary",
      "entity_type": "LOCATION",
      "role_label": "primary_scene",
      "display_name": "primary_scene",
      "fields": [
        {
          "field": "country",
          "value": "Brazil",
          "source_tag": "REAL",
          "sources": [
            "topic_query"
          ]
        },
        {
          "field": "city",
          "value": null,
          "source_tag": "NO_INFO"
        },
        {
          "field": "place_type",
          "value": null,
          "source_tag": "NO_INFO"
        },
        {
          "field": "scene_lighting",
          "value": null,
          "source_tag": "NO_INFO"
        },
        {
          "field": "weather",
          "value": null,
          "source_tag": "NO_INFO"
        }
      ]
    }
  ],
  "context_fields": [
    {
      "field": "visual_assets_available",
      "value": 1,
      "source_tag": "REAL",
      "sources": [
        "topic_research_bundle.visual_assets"
      ]
    }
  ]
}
